activity_title, AI, Robotics, Technology, Innovation, Coding, Competition
"Robotics and Automation Expo", 1, 1, 0, 0, 0, 0
"Annual Music Concert", 0, 0, 0, 1, 0, 0
"Dance and Choreography Showcase", 0, 0, 0, 1, 0, 1
"Tech Startup Showcase", 0, 0, 1, 1, 0, 0
"Innovative App Development Challenge", 0, 0, 0, 1, 1, 1
"AI in Healthcare Seminar", 1, 0, 1, 0, 0, 0
"Coding Bootcamp for Kids", 0, 0, 0, 0, 1, 1
"Tech for Social Good Hackathon", 0, 0, 1, 1, 1, 1
"Tech Innovation Awards Ceremony", 0, 0, 1, 1, 0, 0